{
  "id": "2026-10-14-hrkatha-6607",
  "movement": "panjab-university-staff-2026",
  "date": "2026-10-14",
  "outlet": "HRKatha",
  "kind": "news",
  "url": "https://www.hrkatha.com/protests-and-strikes/strikes-across-india-highlight-worker-demands/",
  "archive_url": "https://web.archive.org/web/20261015065000/https://www.hrkatha.com/protests-and-strikes/strikes-across-india-highlight-worker-demands/",
  "summary": "Third protest in six months over pay and regularisation.",
  "read": true,
  "added": "2026-10-25"
}
