{
  "id": "2025-12-25-outlook-business-9f0b",
  "movement": "gig-workers-strike-2025",
  "date": "2025-12-25",
  "outlet": "Outlook Business",
  "kind": "news",
  "url": "https://www.outlookbusiness.com/start-up/e-commerce/gig-workers-call-all-india-strike-on-christmas-and-new-years-eve-heres-what-they-demand",
  "archive_url": null,
  "summary": "Two delivery workers' unions call all-India strikes on 25 and 31 December. Their demands include fair pay, an end to 10-minute delivery, accident insurance and an end to account blocking without due process.",
  "read": true,
  "drafted_by": "person",
  "added": "2026-10-25"
}
