{
  "id": "2026-01-30-business-standard-pti-9478",
  "movement": "mgnrega-bachao-2026",
  "date": "2026-01-30",
  "outlet": "Business Standard (PTI)",
  "kind": "news",
  "url": "https://www.business-standard.com/politics/govt-attacking-poor-jobs-now-taken-away-congress-during-mgnrega-protest-126013000650_1.html",
  "archive_url": null,
  "summary": "Congress protests at its Delhi headquarters as part of the campaign. Jairam Ramesh says the Centre is eroding a legal right to work.",
  "read": true,
  "drafted_by": "person",
  "added": "2026-10-25"
}
