{
  "id": "2026-01-29-business-standard-f723",
  "movement": "ugc-equity-rules-2026",
  "date": "2026-01-29",
  "outlet": "Business Standard",
  "kind": "news",
  "url": "https://www.business-standard.com/india-news/sc-stays-implementation-of-new-ugc-norms-2012-regulations-to-continue-126012900678_1.html",
  "archive_url": null,
  "summary": "The Supreme Court stays the UGC equity regulations as vague and open to misuse, keeps the 2012 rules in force and asks the Centre to redraft them.",
  "read": true,
  "drafted_by": "person",
  "added": "2026-10-25"
}
