{
  "id": "2026-07-25-wikipedia-6367",
  "movement": "neet-jantar-mantar-2026",
  "date": "2026-07-25",
  "outlet": "Wikipedia",
  "kind": "reference",
  "url": "https://en.wikipedia.org/wiki/2026_NEET_scandal",
  "archive_url": null,
  "summary": "Running record of the 2026 leak: exam on 3 May for over 22 lakh candidates, cancelled on 12 May, CBI arrests, re-test on 21 June and the minister's resignation.",
  "read": true,
  "added": "2026-10-25"
}
