{
  "id": "2026-10-23-china-daily-asia-bloomberg-0fd7",
  "movement": "anti-sir-2026",
  "date": "2026-10-23",
  "outlet": "China Daily Asia (Bloomberg)",
  "kind": "news",
  "url": "https://www.chinadailyasia.com/hk/article/641594",
  "archive_url": null,
  "summary": "Samyukt Kisan Morcha, the farmers' coalition behind the 2020–21 farm-law agitation, joins the campaign with a march to the EC; trade unions plan protests elsewhere.",
  "read": true,
  "added": "2026-10-25"
}
