{
  "id": "2026-05-11-the-wire-cc56",
  "movement": "mgnrega-bachao-2026",
  "date": "2026-05-11",
  "outlet": "The Wire",
  "kind": "news",
  "url": "https://thewire.in/labour/modi-government-announces-mgnrega-will-be-repealed-on-july-1",
  "archive_url": null,
  "summary": "The government announces that MGNREGA will be repealed on 1 July 2026, with its assets, liabilities and records moving to the VB-G RAM G scheme.",
  "read": false,
  "drafted_by": "person",
  "added": "2026-10-25"
}
