{
  "id": "2026-10-12-theprint-pti-c5d3",
  "movement": "tn-hospital-workers-2026",
  "date": "2026-10-12",
  "outlet": "ThePrint (PTI)",
  "kind": "news",
  "url": "https://theprint.in/india/health-workers-protest-tn-govt-needs-time-to-evaluate-demands-says-minister-arunraj/3069444/",
  "archive_url": null,
  "summary": "Over 200 daily-wage hospital workers detained in Chennai as a hunger strike begins. Health Minister K G Arunraj says the government needs time to examine demands submitted five days earlier.",
  "read": true,
  "added": "2026-10-25"
}
