{
  "id": "2025-12-30-deccan-herald-b1c4",
  "movement": "gig-workers-strike-2025",
  "date": "2025-12-30",
  "outlet": "Deccan Herald",
  "kind": "news",
  "url": "https://www.deccanherald.com/amp/story/india%2Fkarnataka%2Fbengaluru%2Fgig-workers-want-ban-on-10-min-delivery-plan-nationwide-strike-on-new-years-eve-3846118",
  "archive_url": null,
  "summary": "Unions plan an 'App Bandh' on New Year's Eve after the Christmas strike disrupted deliveries in Gurugram and parts of Delhi but had little effect in Bengaluru. They want the 10-minute model banned and platforms regulated under labour law.",
  "read": true,
  "drafted_by": "person",
  "added": "2026-10-25"
}
