{
  "id": "2025-09-26-bol-news-1c13",
  "movement": "ladakh-statehood",
  "date": "2025-09-26",
  "outlet": "BOL News",
  "kind": "background",
  "url": "https://www.bolnews.com/latest-news/five-killed-in-ladakh-protest-demanding-autonomy",
  "archive_url": null,
  "summary": "The September 2025 clashes in Leh; official and activist death tolls differ.",
  "read": true,
  "added": "2026-10-25"
}
