{
  "id": "2026-02-05-the-polis-project-a73b",
  "movement": "delhi-clean-air-2025",
  "date": "2026-02-05",
  "outlet": "The Polis Project",
  "kind": "opinion",
  "url": "https://thepolisproject.com/?p=19830",
  "archive_url": null,
  "summary": "Account of the 23 arrests after the 23 November protest. It says a sedition charge was added later and bail came in stages, with the last detainee freed on 31 December, and that the state conceded it had no evidence linking any detainee to Maoist groups.",
  "read": true,
  "drafted_by": "person",
  "added": "2026-10-25"
}
