{
  "id": "2026-10-16-world-socialist-web-site-4eae",
  "movement": "ntc-mill-workers-2026",
  "date": "2026-10-16",
  "outlet": "World Socialist Web Site",
  "kind": "roundup",
  "url": "https://www.wsws.org/en/articles/2026/10/16/nrbi-o16.html",
  "archive_url": null,
  "summary": "Indefinite relay hunger strike from 6 October.",
  "read": true,
  "added": "2026-10-25"
}
