{
  "id": "2025-11-09-scroll-ff27",
  "movement": "delhi-clean-air-2025",
  "date": "2025-11-09",
  "outlet": "Scroll",
  "kind": "news",
  "url": "https://scroll.in/latest/1088408/scroll_in",
  "archive_url": null,
  "summary": "Organisers of the 9 November India Gate protest say police pressed them for days to call it off. Police detained several protesters, including senior citizens, calling the detentions preventive, and said only Jantar Mantar is a designated protest site.",
  "read": true,
  "drafted_by": "person",
  "added": "2026-10-25"
}
