{
  "id": "2026-05-22-wikipedia-7cd8",
  "movement": "ladakh-statehood",
  "date": "2026-05-22",
  "outlet": "Wikipedia",
  "kind": "reference",
  "url": "https://en.wikipedia.org/wiki/Ladakh_protests",
  "archive_url": null,
  "summary": "Timeline through the resumed talks with the Home Ministry.",
  "read": true,
  "added": "2026-10-25"
}
