{
  "id": "2026-10-23-business-standard-225a",
  "movement": "anti-sir-2026",
  "date": "2026-10-23",
  "outlet": "Business Standard",
  "kind": "news",
  "url": "https://www.business-standard.com/amp/india-news/over-100-detained-in-delhi-as-protests-against-cec-gyanesh-kumar-resume-126102301637_1.html",
  "archive_url": "https://web.archive.org/web/20261024015814/https://www.business-standard.com/amp/india-news/over-100-detained-in-delhi-as-protests-against-cec-gyanesh-kumar-resume-126102301637_1.html",
  "summary": "Over 100 detained as a march from Gole Dak Khana to the Election Commission is stopped near Bangla Sahib; protesters hold a 'People's Parliament' on the road. Delhi HC rejects AISA president Neha Bora's petition against a peace-bond notice.",
  "read": true,
  "added": "2026-10-25"
}
