{
  "id": "2026-09-30-deccan-herald-209c",
  "movement": "anti-sir-2026",
  "date": "2026-09-30",
  "outlet": "Deccan Herald",
  "kind": "news",
  "url": "https://www.deccanherald.com/india/sir-133-crore-names-wiped-out-of-draft-voter-lists-so-far-triggering-opposition-backlash-4164836",
  "archive_url": null,
  "summary": "About 13.3 crore names removed from draft rolls so far: 71.5% marked absent or shifted, 21% dead, 7.5% duplicates. The Congress demands all names be restored.",
  "read": true,
  "added": "2026-10-25"
}
