{
  "id": "2026-07-25-delhi-student-protest-465b",
  "movement": "neet-jantar-mantar-2026",
  "date": "2026-07-25",
  "outlet": "Delhi Student Protest",
  "kind": "archive",
  "url": "https://www.delhistudentprotest.com/post",
  "archive_url": null,
  "summary": "275 posts from 21 June to 25 July, organised by day.",
  "read": true,
  "added": "2026-10-25"
}
