{
  "id": "2026-10-22-mediasaheb-4dc7",
  "movement": "jharkhand-108-ambulance-2026",
  "date": "2026-10-22",
  "outlet": "Mediasaheb",
  "kind": "news",
  "url": "https://mediasaheb.com/the-108-ambulance-service-in-jharkhand-is-at-risk-of-being-disrupted-from-october-26th-with-employees-going-on-an-indefinite-strike",
  "archive_url": null,
  "summary": "The ambulance workers' union moves its indefinite statewide strike to 26 October after assurances brought no result. More than 300 ambulances could stop; salaries are pending since July.",
  "read": true,
  "added": "2026-10-25"
}
