{
  "id": "2026-10-12-al-jazeera-f174",
  "movement": "anti-sir-2026",
  "date": "2026-10-12",
  "outlet": "Al Jazeera",
  "kind": "news",
  "url": "https://www.aljazeera.com/news/2026/10/12/india-opposition-plans-new-delhi-protest-to-demand-election-chief-resign",
  "archive_url": null,
  "summary": "Thousands march towards the Supreme Court; police detain thousands over the weekend, including journalists showing press cards.",
  "read": false,
  "added": "2026-10-25"
}
