{
  "id": "2026-10-16-world-socialist-web-site-c96d",
  "movement": "panjab-university-staff-2026",
  "date": "2026-10-16",
  "outlet": "World Socialist Web Site",
  "kind": "roundup",
  "url": "https://www.wsws.org/en/articles/2026/10/16/nrbi-o16.html",
  "archive_url": null,
  "summary": "Protest on 14 October.",
  "read": true,
  "added": "2026-10-25"
}
