{
  "id": "2025-11-09-deccan-herald-ee0e",
  "movement": "karnataka-sugarcane-2025",
  "date": "2025-11-09",
  "outlet": "Deccan Herald",
  "kind": "news",
  "url": "https://www.deccanherald.com/amp/story/india%2Fkarnataka%2Fsugarcane-farmers-call-off-protest-after-minister-shivanand-patil-visits-site-persuades-them-3791622",
  "archive_url": null,
  "summary": "Farmers at Gurlapur Cross end their 10-day protest after the sugar minister brings an order setting Rs 3,300 a tonne. A bandh in Bailhongal turns violent in places before it too is called off.",
  "read": true,
  "drafted_by": "person",
  "added": "2026-10-25"
}
