{
  "id": "2023-07-07-citizen-matters-3bb2",
  "movement": "ntc-mill-workers-2026",
  "date": "2023-07-07",
  "outlet": "Citizen Matters",
  "kind": "background",
  "url": "https://citizenmatters.in/ntc-mills-closure-after-covid-mumbai/",
  "archive_url": null,
  "summary": "Background: Mumbai's four NTC mills shut in the pandemic and never reopened; workers moved to half pay and some take home under Rs 2,000 a month after deductions.",
  "read": true,
  "added": "2026-10-25"
}
