{
  "id": "2026-10-10-npr-13d8",
  "movement": "anti-sir-2026",
  "date": "2026-10-10",
  "outlet": "NPR",
  "kind": "news",
  "url": "https://www.npr.org/2026/10/10/g-s1-147603/india-cracks-down-on-youth-protests-as-anger-grows-against-modi-and-election-chief",
  "archive_url": null,
  "summary": "Report on the crackdown on youth protests in Delhi.",
  "read": false,
  "added": "2026-10-25"
}
