{
  "id": "2026-10-16-npr-1b49",
  "movement": "anti-sir-2026",
  "date": "2026-10-16",
  "outlet": "NPR",
  "kind": "news",
  "url": "https://www.npr.org/2026/10/16/g-s1-148383/crowds-throng-new-delhi-and-wave-indian-flags-amid-escalating-protests",
  "archive_url": "https://web.archive.org/web/20261021202614/https://www.npr.org/2026/10/16/g-s1-148383/crowds-throng-new-delhi-and-wave-indian-flags-amid-escalating-protests",
  "summary": "Tricolour-waving youth protest in central Delhi a week after a crackdown; student leader Neha Bora detained.",
  "read": false,
  "added": "2026-10-25"
}
